D1: Daftar Lampiran II
D3: Surat Keputusan Ketua Pengadilan Negeri Tondano Kelas IB
D4: Nomor : W19-U2/ /HT/V/2023
A6: TINGKAT PERTAMA
A7: PERKARA GUGATAN / BANTAHAN / PERLAWANAN
A8: No. | B8: Uraian | C8: Biaya
C9: Radius 1 | D9: Radius II | E9: Radius III | F9: Radius IV | G9: Radius V | H9: Radius VI
A10: 1 | B10: Pendaftaran | C10: 30000 | D10: 30000 | E10: 30000 | F10: 30000 | G10: 30000 | H10: 30000
A11: 2 | B11: Biaya Proses/ATK | C11: 50000 | D11: 50000 | E11: 50000 | F11: 50000 | G11: 50000 | H11: 50000
A12: 3 | B12: PNBP Surat Kuasa | C12: 10000 | D12: 10000 | E12: 10000 | F12: 10000 | G12: 10000 | H12: 10000
A13: 4 | B13: Panggilan Penggugat 2x | C13: 200000 | D13: 300000 | E13: 350000 | F13: 400000 | G13: 500000 | H13: 700000
A14: 5 | B14: Panggilan Tergugat 3x | C14: 300000 | D14: 450000 | E14: 525000 | F14: 600000 | G14: 750000 | H14: 1050000
A15: 6 | B15: Panggilan Mediasi P 2x | C15: 200000 | D15: 300000 | E15: 350000 | F15: 400000 | G15: 500000 | H15: 700000
A16: 7 | B16: Panggilan Mediasi T 2x | C16: 200000 | D16: 300000 | E16: 350000 | F16: 400000 | G16: 500000 | H16: 700000
A17: 8 | B17: Materai | C17: 10000 | D17: 10000 | E17: 10000 | F17: 10000 | G17: 10000 | H17: 10000
A18: 9 | B18: Redaksi | C18: 10000 | D18: 10000 | E18: 10000 | F18: 10000 | G18: 10000 | H18: 10000
A19: 10 | B19: Pemberitahuan Putusan Penggugat dan Tergugat | C19: 200000 | D19: 300000 | E19: 350000 | F19: 400000 | G19: 500000 | H19: 700000
A20: 11 | B20: PNBP Panggilan dan Pemberitahuan 9x | C20: 90000 | D20: 90000 | E20: 90000 | F20: 90000 | G20: 90000 | H20: 90000
A21: 12 | B21: PNBP Pencabutan | C21: 10000 | D21: 10000 | E21: 10000 | F21: 10000 | G21: 10000 | H21: 10000
A22: JUMLAH | C22: =SUM(C10:C21) -> 1310000 | D22: =SUM(D10:D21) -> 1860000 | E22: =SUM(E10:E21) -> 2135000 | F22: =SUM(F10:F21) -> 2410000 | G22: =SUM(G10:G21) -> 2960000 | H22: =SUM(H10:H21) -> 4060000
A24: PERKARA PERMOHONAN
A25: No. | B25: Uraian | C25: Biaya
C26: Radius 1 | D26: Radius II | E26: Radius III | F26: Radius IV | G26: Radius V | H26: Radius VI
A27: 1 | B27: Pendaftaran | C27: 30000 | D27: 30000 | E27: 30000 | F27: 30000 | G27: 30000 | H27: 30000
A28: 2 | B28: Biaya Proses/ATK | C28: 50000 | D28: 50000 | E28: 50000 | F28: 50000 | G28: 50000 | H28: 50000
A29: 3 | B29: PNBP Surat Kuasa | C29: 10000 | D29: 10000 | E29: 10000 | F29: 10000 | G29: 10000 | H29: 10000
A30: 4 | B30: Panggilan 2x | C30: 200000 | D30: 300000 | E30: 350000 | F30: 400000 | G30: 500000 | H30: 700000
A31: 5 | B31: Materai | C31: 10000 | D31: 10000 | E31: 10000 | F31: 10000 | G31: 10000 | H31: 10000
A32: 6 | B32: Redaksi | C32: 10000 | D32: 10000 | E32: 10000 | F32: 10000 | G32: 10000 | H32: 10000
A33: 7 | B33: Biaya Pemberitahuan Penetapan | C33: 100000 | D33: 150000 | E33: 175000 | F33: 200000 | G33: 250000 | H33: 350000
A34: 8 | B34: PNBP Panggilan dan Pemberitahuan 2x | C34: 20000 | D34: 20000 | E34: 20000 | F34: 20000 | G34: 20000 | H34: 20000
A35: 9 | B35: PNBP Pencabutan | C35: 10000 | D35: 10000 | E35: 10000 | F35: 10000 | G35: 10000 | H35: 10000
A36: JUMLAH | C36: =SUM(C27:C35) -> 440000 | D36: =SUM(D27:D35) -> 590000 | E36: =SUM(E27:E35) -> 665000 | F36: =SUM(F27:F35) -> 740000 | G36: =SUM(G27:G35) -> 890000 | H36: =SUM(H27:H35) -> 1190000
A38: PERKARA GUGATAN SEDERHANA
A39: No. | B39: Uraian | C39: Biaya
C40: Radius 1 | D40: Radius II | E40: Radius III | F40: Radius IV | G40: Radius V | H40: Radius VI
A41: 1 | B41: Pendaftaran | C41: 30000 | D41: 30000 | E41: 30000 | F41: 30000 | G41: 30000 | H41: 30000
A42: 2 | B42: Biaya Proses/ATK | C42: 50000 | D42: 50000 | E42: 50000 | F42: 50000 | G42: 50000 | H42: 50000
A43: 3 | B43: PNBP Surat Kuasa | C43: 10000 | D43: 10000 | E43: 10000 | F43: 10000 | G43: 10000 | H43: 10000
A44: 4 | B44: Panggilan Penggugat 2x | C44: 200000 | D44: 300000 | E44: 350000 | F44: 400000 | G44: 500000 | H44: 700000
A45: 5 | B45: Panggilan Tergugat 3x | C45: 300000 | D45: 450000 | E45: 525000 | F45: 600000 | G45: 750000 | H45: 1050000
A46: 6 | B46: Materai | C46: 10000 | D46: 10000 | E46: 10000 | F46: 10000 | G46: 10000 | H46: 10000
A47: 7 | B47: Redaksi | C47: 10000 | D47: 10000 | E47: 10000 | F47: 10000 | G47: 10000 | H47: 10000
A48: 8 | B48: Pemberitahuan Putusan Penggugat dan Tergugat | C48: 200000 | D48: 300000 | E48: 350000 | F48: 400000 | G48: 500000 | H48: 700000
A49: 9 | B49: PNBP Panggilan dan Pemberitahuan 4x | C49: 40000 | D49: 40000 | E49: 40000 | F49: 40000 | G49: 40000 | H49: 40000
A50: 10 | B50: PNBP Pencabutan | C50: 10000 | D50: 10000 | E50: 10000 | F50: 10000 | G50: 10000 | H50: 10000
A51: JUMLAH | C51: =SUM(C41:C50) -> 860000 | D51: =SUM(D41:D50) -> 1210000 | E51: =SUM(E41:E50) -> 1385000 | F51: =SUM(F41:F50) -> 1560000 | G51: =SUM(G41:G50) -> 1910000 | H51: =SUM(H41:H50) -> 2610000
A53: PERKARA KEBERATAN TERHADAP GUGATAN SEDERHANA
A54: No. | B54: Uraian | C54: Biaya
C55: Radius I | D55: Radius II | E55: Radius III | F55: Radius IV | G55: Radius V | H55: Radius VI
A56: 1 | B56: Pemberitahuan Pernyataan Keberatan | C56: 100000 | D56: 150000 | E56: 175000 | F56: 200000 | G56: 250000 | H56: 350000
A57: 2 | B57: Pemberitahuan Memori Keberatan | C57: 100000 | D57: 150000 | E57: 175000 | F57: 200000 | G57: 250000 | H57: 350000
A58: 3 | B58: Pemberitahuan Kontra Memori Keberatan | C58: 100000 | D58: 150000 | E58: 175000 | F58: 200000 | G58: 250000 | H58: 350000
A59: 4 | B59: Materai | C59: 10000 | D59: 10000 | E59: 10000 | F59: 10000 | G59: 10000 | H59: 10000
A60: 5 | B60: Redaksi | C60: 10000 | D60: 10000 | E60: 10000 | F60: 10000 | G60: 10000 | H60: 10000
A61: 6 | B61: Pemberitahuan Isi Putusan Keberatan P dan T | C61: 200000 | D61: 300000 | E61: 350000 | F61: 400000 | G61: 500000 | H61: 400000
A62: 7 | B62: PNBP Relaas-relaas 5x | C62: 50000 | D62: 50000 | E62: 50000 | F62: 50000 | G62: 50000 | H62: 50000
A63: JUMLAH | C63: =SUM(C56:C62) -> 570000 | D63: =SUM(D56:D62) -> 820000 | E63: =SUM(E56:E62) -> 945000 | F63: =SUM(F56:F62) -> 1070000 | G63: =SUM(G56:G62) -> 1320000 | H63: =SUM(H56:H62) -> 1520000
A65: BIAYA PANGGILAN MELALUI IKLAN/RADIO/PENGUMUMAN
A66: No. | B66: Uraian | C66: Biaya
A67: 1 | B67: Biaya Panggilan Melalui Iklan (Koran) untuk 1x Iklan | C67: 2000000
A68: 2 | B68: PNBP Relaas | C68: 10000
A69: 3 | B69: Biaya Panggilan Melalui Radio untuk 1x Siaran | C69: 175000
A70: 4 | B70: PNBP Relaas | C70: 10000
A71: 5 | B71: Biaya Panggilan Melalui Pengumuman | C71: 175000
A72: 6 | B72: PNBP Relaas | C72: 10000
A74: TINGKAT BANDING
A75: PERMOHONAN BANDING
A76: No. | B76: Uraian | C76: Biaya
C77: Radius 1 | D77: Radius II | E77: Radius III | F77: Radius IV | G77: Radius V | H77: Radius VI
A78: 1 | B78: Pendaftaran | C78: 50000 | D78: 50000 | E78: 50000 | F78: 50000 | G78: 50000 | H78: 50000
A79: 2 | B79: Biaya Proses/ATK | C79: 140000 | D79: 140000 | E79: 140000 | F79: 140000 | G79: 140000 | H79: 140000
A80: 3 | B80: PNBP Akta Banding | C80: 10000 | D80: 10000 | E80: 10000 | F80: 10000 | G80: 10000 | H80: 10000
A81: 4 | B81: Pemberitahuan Banding | C81: 100000 | D81: 150000 | E81: 175000 | F81: 200000 | G81: 250000 | H81: 350000
A82: 5 | B82: Penyerahan Memori Banding | C82: 100000 | D82: 150000 | E82: 175000 | F82: 200000 | G82: 250000 | H82: 350000
A83: 6 | B83: Penyerahan Kontra Banding | C83: 100000 | D83: 150000 | E83: 175000 | F83: 200000 | G83: 250000 | H83: 350000
A84: 7 | B84: Pemberitahuan Inzage P dan T | C84: 200000 | D84: 300000 | E84: 350000 | F84: 400000 | G84: 500000 | H84: 700000
A85: 8 | B85: Biaya Proses Pengadilan Tinggi | C85: 150000 | D85: 150000 | E85: 150000 | F85: 150000 | G85: 150000 | H85: 150000
A86: 9 | B86: Pemberitahuan Putusan P dan T | C86: 200000 | D86: 300000 | E86: 350000 | F86: 400000 | G86: 500000 | H86: 700000
A87: 10 | B87: PNBP Relaas 7x | C87: 70000 | D87: 70000 | E87: 70000 | F87: 70000 | G87: 70000 | H87: 70000
A88: JUMLAH | C88: =SUM(C78:C87) -> 1120000 | D88: =SUM(D78:D87) -> 1470000 | E88: =SUM(E78:E87) -> 1645000 | F88: =SUM(F78:F87) -> 1820000 | G88: =SUM(G78:G87) -> 2170000 | H88: =SUM(H78:H87) -> 2870000
A90: TINGKAT KASASI
A91: PERMOHONAN KASASI
A92: No. | B92: Uraian | C92: Biaya
C93: Radius 1 | D93: Radius II | E93: Radius III | F93: Radius IV | G93: Radius V | H93: Radius VI
A94: 1 | B94: Pendaftaran | C94: 50000 | D94: 50000 | E94: 50000 | F94: 50000 | G94: 50000 | H94: 50000
A95: 2 | B95: Biaya Proses/ATK | C95: 210000 | D95: 210000 | E95: 210000 | F95: 210000 | G95: 210000 | H95: 210000
A96: 3 | B96: PNBP Akta Kasasi | C96: 10000 | D96: 10000 | E96: 10000 | F96: 10000 | G96: 10000 | H96: 10000
A97: 4 | B97: Pemberitahuan Kasasi | C97: 100000 | D97: 150000 | E97: 175000 | F97: 200000 | G97: 250000 | H97: 350000
A98: 5 | B98: Penyerahan Memori Kasasi | C98: 100000 | D98: 150000 | E98: 175000 | F98: 200000 | G98: 250000 | H98: 350000
A99: 6 | B99: Penyerahan Kontra Kasasi | C99: 100000 | D99: 150000 | E99: 175000 | F99: 200000 | G99: 250000 | H99: 350000
A100: 7 | B100: Pemberitahuan Inzage P dan T | C100: 200000 | D100: 300000 | E100: 350000 | F100: 400000 | G100: 500000 | H100: 700000
A101: 8 | B101: Biaya Pengiriman ke MA | C101: 500000 | D101: 500000 | E101: 500000 | F101: 500000 | G101: 500000 | H101: 500000
A102: 9 | B102: Pemberitahuan Putusan 2 orang P dan T | C102: 200000 | D102: 300000 | E102: 350000 | F102: 400000 | G102: 500000 | H102: 700000
A103: 10 | B103: PNBP Relaas / Pemberitahuan 5x | C103: 50000 | D103: 50000 | E103: 50000 | F103: 50000 | G103: 50000 | H103: 50000
A104: JUMLAH | C104: =SUM(C94:C103) -> 1520000 | D104: =SUM(D94:D103) -> 1870000 | E104: =SUM(E94:E103) -> 2045000 | F104: =SUM(F94:F103) -> 2220000 | G104: =SUM(G94:G103) -> 2570000 | H104: =SUM(H94:H103) -> 3270000
A106: TINGKAT PENINJAUAN KEMBALI
A107: PERMOHONAN PENINJAUAN KEMBALI
A108: No. | B108: Uraian | C108: Biaya
C109: Radius 1 | D109: Radius II | E109: Radius III | F109: Radius IV | G109: Radius V | H109: Radius VI
A110: 1 | B110: Pendaftaran | C110: 200000 | D110: 200000 | E110: 200000 | F110: 200000 | G110: 200000 | H110: 200000
A111: 2. | B111: Biaya Proses/ATK | C111: 210000 | D111: 210000 | E111: 210000 | F111: 210000 | G111: 210000 | H111: 210000
A112: 3. | B112: PNBP Akta PK | C112: 10000 | D112: 10000 | E112: 10000 | F112: 10000 | G112: 10000 | H112: 10000
A113: 4. | B113: PNBP Penyumpahan Novum (bukti baru) PK | C113: 10000 | D113: 10000 | E113: 10000 | F113: 10000 | G113: 10000 | H113: 10000
A114: 5. | B114: Biaya Peninjauan Kembali | C114: 2500000 | D114: 2500000 | E114: 2500000 | F114: 2500000 | G114: 2500000 | H114: 2500000
A115: 6. | B115: Pemberitahuan dan Penyerahan Memori PK | C115: 100000 | D115: 150000 | E115: 175000 | F115: 200000 | G115: 250000 | H115: 350000
A116: 7. | B116: Pemberitahuan Jawaban/Kontra Memori PK | C116: 100000 | D116: 150000 | E116: 175000 | F116: 200000 | G116: 250000 | H116: 350000
A117: 8 | B117: Pemberitahuan Putusan Penggugat dan Tergugat | C117: 200000 | D117: 300000 | E117: 350000 | F117: 400000 | G117: 500000 | H117: 700000
A118: 9 | B118: PNBP Pemberitahuan 7x | C118: 70000 | D118: 70000 | E118: 70000 | F118: 70000 | G118: 70000 | H118: 70000
A119: JUMLAH | C119: =SUM(C110:C118) -> 3400000 | D119: =SUM(D110:D118) -> 3600000 | E119: =SUM(E110:E118) -> 3700000 | F119: =SUM(F110:F118) -> 3800000 | G119: =SUM(G110:G118) -> 4000000 | H119: =SUM(H110:H118) -> 4400000
A121: Permohonan Sita Jaminan / Pengangkatan Sita Jaminan
A122: No. | B122: Uraian | C122: Biaya | D122: Biaya | E122: Biaya | F122: Biaya | G122: Biaya | H122: Biaya
A123: 1 | B123: Redaksi Surat Penetapan | C123: 10000 | D123: 10000 | E123: 10000 | F123: 10000 | G123: 10000 | H123: 10000
A124: 2 | B124: Materai Penetapan | C124: 10000 | D124: 10000 | E124: 10000 | F124: 10000 | G124: 10000 | H124: 10000
A125: 3 | B125: Fotokopi Berita Acara | C125: 50000 | D125: 50000 | E125: 50000 | F125: 50000 | G125: 50000 | H125: 50000
A126: 4 | B126: Transportasi | C126: 500000 | D126: 750000 | E126: 1000000 | F126: 1250000 | G126: 1500000 | H126: 1750000
A127: 5 | B127: Upah Jurusita | C127: 750000 | D127: 750000 | E127: 750000 | F127: 750000 | G127: 750000 | H127: 750000
A128: 6 | B128: Biaya 2 Orang Saksi | C128: 1000000 | D128: 1000000 | E128: 1000000 | F128: 1000000 | G128: 1000000 | H128: 1000000
A129: 7 | B129: Biaya Pendaftaran PNBP | C129: 10000 | D129: 10000 | E129: 10000 | F129: 10000 | G129: 10000 | H129: 10000
A130: 8 | B130: PNBP | C130: 25000 | D130: 25000 | E130: 25000 | F130: 25000 | G130: 25000 | H130: 25000
A131: JUMLAH | C131: =SUM(C123:C130) -> 2355000 | D131: =SUM(D123:D130) -> 2605000 | E131: =SUM(E123:E130) -> 2855000 | F131: =SUM(F123:F130) -> 3105000 | G131: =SUM(G123:G130) -> 3355000 | H131: =SUM(H123:H130) -> 3605000
A133: Permohonan Sita Eksekusi dan Pengangkatan Sita Eksekusi
A134: No. | B134: Uraian | C134: Biaya | D134: Biaya | E134: Biaya | F134: Biaya | G134: Biaya | H134: Biaya
A135: 1 | B135: Materai Penetapan | C135: 10000 | D135: 10000 | E135: 10000 | F135: 10000 | G135: 10000 | H135: 10000
A136: 2 | B136: Materai Berita Acara | C136: 10000 | D136: 10000 | E136: 10000 | F136: 10000 | G136: 10000 | H136: 10000
A137: 3 | B137: Fotokopi Berita Acara (5 Set) | C137: 50000 | D137: 50000 | E137: 50000 | F137: 50000 | G137: 50000 | H137: 50000
A138: 4 | B138: Transportasi | C138: 500000 | D138: 750000 | E138: 1000000 | F138: 1250000 | G138: 1500000 | H138: 1750000
A139: 5 | B139: Upah Jurusita | C139: 750000 | D139: 750000 | E139: 750000 | F139: 750000 | G139: 750000 | H139: 750000
A140: 6 | B140: Biaya 2 Orang Saksi | C140: 1000000 | D140: 1000000 | E140: 1000000 | F140: 1000000 | G140: 1000000 | H140: 1000000
A141: 7 | B141: Biaya Pendaftaran Sita ke BPN | C141: 150000 | D141: 150000 | E141: 150000 | F141: 150000 | G141: 150000 | H141: 150000
A142: 8 | B142: PNBP Pendaftaran Permohonan Sita Eksekusi | C142: 25000 | D142: 25000 | E142: 25000 | F142: 25000 | G142: 25000 | H142: 25000
A143: 9 | B143: PNBP Penetapan Sita Eksekusi | C143: 10000 | D143: 10000 | E143: 10000 | F143: 10000 | G143: 10000 | H143: 10000
A144: 10 | B144: PNBP Berita Acara Sita Eksekusi | C144: 10000 | D144: 10000 | E144: 10000 | F144: 10000 | G144: 10000 | H144: 10000
A145: 11 | B145: PNBP Penyerahan Salinan Berita Acara Sita Eksekusi (Per Objek) | C145: 10000 | D145: 10000 | E145: 10000 | F145: 10000 | G145: 10000 | H145: 10000
A146: JUMLAH | C146: =SUM(C135:C145) -> 2525000 | D146: =SUM(D135:D145) -> 2775000 | E146: =SUM(E135:E145) -> 3025000 | F146: =SUM(F135:F145) -> 3275000 | G146: =SUM(G135:G145) -> 3525000 | H146: =SUM(H135:H145) -> 3775000
A148: PERMOHONAN EKSEKUSI PENGOSONGAN / PENYERAHAN ATAS PUTUSAN PENGADILAN
A149: No. | B149: Uraian | C149: BIAYA
C150: Radius I | D150: Radius II | E150: Radius III | F150: Radius IV | G150: Radius V | H150: Radius VI
A151: 1 | B151: Materai Penetapan Teguran | C151: 10000 | D151: 10000 | E151: 10000 | F151: 10000 | G151: 10000 | H151: 10000
A152: 2 | B152: PNBP Pendaftaran Permohonan Eksekusi | C152: 10000 | D152: 10000 | E152: 10000 | F152: 10000 | G152: 10000 | H152: 10000
A153: 3 | B153: PNBP Penetapan Teguran | C153: 10000 | D153: 10000 | E153: 10000 | F153: 10000 | G153: 10000 | H153: 10000
A154: 4 | B154: PNBP Berita Acara Teguran | C154: 10000 | D154: 10000 | E154: 10000 | F154: 10000 | G154: 10000 | H154: 10000
A155: 5 | B155: PNBP Relaas Panggilan kepada P dan T | C155: 20000 | D155: 20000 | E155: 20000 | F155: 20000 | G155: 20000 | H155: 20000
A156: 6 | B156: Panggilan Teguran P-2x, T-2x | C156: 400000 | D156: 600000 | E156: 700000 | F156: 800000 | G156: 1000000 | H156: 1400000
A157: 7 | B157: Biaya Proses | C157: 50000 | D157: 50000 | E157: 50000 | F157: 50000 | G157: 50000 | H157: 50000
A158: 8 | B158: Materai Penetapan Eksekusi (4 x @ Rp 10.000) | C158: 40000 | D158: 40000 | E158: 40000 | F158: 40000 | G158: 40000 | H158: 40000
A159: 9 | B159: Materai Berita Acara Eksekusi | C159: 10000 | D159: 10000 | E159: 10000 | F159: 10000 | G159: 10000 | H159: 10000
A160: 10 | B160: Fotokopi Berita Acara (5 set) | C160: 50000 | D160: 50000 | E160: 50000 | F160: 50000 | G160: 50000 | H160: 50000
A161: 11 | B161: PNBP Penetapan Eksekusi | C161: 25000 | D161: 25000 | E161: 25000 | F161: 25000 | G161: 25000 | H161: 25000
A162: 12 | B162: PNBP Berita Acara Eksekusi | C162: 25000 | D162: 25000 | E162: 25000 | F162: 25000 | G162: 25000 | H162: 25000
A163: 13 | B163: PNBP Penyerahan Salinan Berita Acara Eksekusi | C163: 20000 | D163: 20000 | E163: 20000 | F163: 20000 | G163: 20000 | H163: 20000
A164: 14 | B164: Biaya Konstatering | C164: 1000000 | D164: 1250000 | E164: 1500000 | F164: 1750000 | G164: 2000000 | H164: 2500000
A165: 15 | B165: Biaya Saksi (2 Orang) | C165: 1000000 | D165: 1000000 | E165: 1000000 | F165: 1000000 | G165: 1000000 | H165: 1000000
A166: 16 | B166: Rakor Eksekusi (15 orang) dan konsumsi | C166: 2500000 | D166: 2500000 | E166: 2500000 | F166: 2500000 | G166: 2500000 | H166: 2500000
A167: 17 | B167: Biaya penyerahan undangan Rakor | C167: 200000 | D167: 200000 | E167: 200000 | F167: 200000 | G167: 200000 | H167: 200000
A168: 18 | B168: Biaya Pemberitahuan Pelaksanaan Eksekusi | C168: 200000 | D168: 200000 | E168: 200000 | F168: 200000 | G168: 200000 | H168: 200000
A169: 19 | B169: Biaya Pelaksanaan Eksekusi | C169: 4500000 | D169: 4500000 | E169: 4500000 | F169: 4500000 | G169: 4500000 | H169: 4500000
A170: JUMLAH | C170: =SUM(C151:C169) -> 10080000 | D170: =SUM(D151:D169) -> 10530000 | E170: =SUM(E151:E169) -> 10880000 | F170: =SUM(F151:F169) -> 11230000 | G170: =SUM(G151:G169) -> 11680000 | H170: =SUM(H151:H169) -> 12580000
A172: EKSEKUSI LELANG ATAS PUTUSAN PENGADILAN DAN LELANG HAK TANGGUNGAN
A173: No. | B173: Uraian | C173: BIAYA
C174: Radius 1 | D174: Radius II | E174: Radius III | F174: Radius IV | G174: Radius V | H174: Radius VI
A175: 1 | B175: Materai Penetapan Teguran | C175: 10000 | D175: 10000 | E175: 10000 | F175: 10000 | G175: 10000 | H175: 10000
A176: 2 | B176: PNBP Pendaftaran Permohonan Eksekusi | C176: 10000 | D176: 10000 | E176: 10000 | F176: 10000 | G176: 10000 | H176: 10000
A177: 3 | B177: PNBP Penetapan Teguran | C177: 10000 | D177: 10000 | E177: 10000 | F177: 10000 | G177: 10000 | H177: 10000
A178: 4 | B178: PNBP Berita Acara Teguran | C178: 10000 | D178: 10000 | E178: 10000 | F178: 10000 | G178: 10000 | H178: 10000
A179: 5 | B179: PNBP Relaas Panggilan kepada P dan T | C179: 20000 | D179: 20000 | E179: 20000 | F179: 20000 | G179: 20000 | H179: 20000
A180: 6 | B180: Panggilan Teguran P-2x, T-2x | C180: 400000 | D180: 600000 | E180: 700000 | F180: 800000 | G180: 1000000 | H180: 1400000
A181: 7 | B181: Biaya Proses | C181: 50000 | D181: 50000 | E181: 50000 | F181: 50000 | G181: 50000 | H181: 50000
A182: 8 | B182: Materai Penetapan Eksekusi (4 x @ Rp 10.000) | C182: 40000 | D182: 40000 | E182: 40000 | F182: 40000 | G182: 40000 | H182: 40000
A183: 9 | B183: Materai Berita Acara Eksekusi Lelang | C183: 10000 | D183: 10000 | E183: 10000 | F183: 10000 | G183: 10000 | H183: 10000
A184: 10 | B184: PNBP Berita Acara Teguran 3x | C184: 30000 | D184: 30000 | E184: 30000 | F184: 30000 | G184: 30000 | H184: 30000
A185: 11 | B185: PNBP Penetapan Lelang | C185: 10000 | D185: 10000 | E185: 10000 | F185: 10000 | G185: 10000 | H185: 10000
A186: 12 | B186: PNBP Pengumuman Lelang | C186: 10000 | D186: 10000 | E186: 10000 | F186: 10000 | G186: 10000 | H186: 10000
A187: 13 | B187: PNBP Pembagian Hasil Lelang | C187: 10000 | D187: 10000 | E187: 10000 | F187: 10000 | G187: 10000 | H187: 10000
A188: 14 | B188: Biaya Konstatering | C188: 700000 | D188: 1000000 | E188: 1250000 | F188: 1500000 | G188: 1750000 | H188: 2000000
A189: 15 | B189: Biaya Iklan Surat Kabar (2 x @ Rp 2.700.000) | C189: 5400000 | D189: 5400000 | E189: 5400000 | F189: 5400000 | G189: 5400000 | H189: 5400000
A190: 16 | B190: Transportasi ke kantor Lelang 3x | C190: 450000 | D190: 450000 | E190: 450000 | F190: 450000 | G190: 450000 | H190: 450000
A191: 17 | B191: Biaya pemberitahuan Lelang : P, T, Lurah, BPN, KPKNL | C191: 500000 | D191: 750000 | E191: 875000 | F191: 1000000 | G191: 1250000 | H191: 1750000
A192: 18 | B192: Biaya Pendaftaran Lelang (disetor ke KPKNL) | C192: 150000 | D192: 150000 | E192: 150000 | F192: 150000 | G192: 150000 | H192: 150000
A193: 19 | B193: Biaya Pembuatan SKPT | C193: 100000 | D193: 100000 | E193: 100000 | F193: 100000 | G193: 100000 | H193: 100000
A194: 20 | B194: Biaya Pelaksanaan Lelang* | C194: 2000000 | D194: 2000000 | E194: 2000000 | F194: 2000000 | G194: 2000000 | H194: 2000000
A195: 21 | B195: PNBP Penetapan Pencabutan Perintah Lelang | C195: 25000 | D195: 25000 | E195: 25000 | F195: 25000 | G195: 25000 | H195: 25000
A196: 22 | B196: PNBP Pengumuman Pencabutan Lelang | C196: 10000 | D196: 10000 | E196: 10000 | F196: 10000 | G196: 10000 | H196: 10000
A197: JUMLAH | C197: =SUM(C175:C196) -> 9955000 | D197: =SUM(D175:D196) -> 10705000 | E197: =SUM(E175:E196) -> 11180000 | F197: =SUM(F175:F196) -> 11655000 | G197: =SUM(G175:G196) -> 12355000 | H197: =SUM(H175:H196) -> 13505000
A199: PEMERIKSAAN SETEMPAT ( PS )
A200: No. | B200: Uraian | C200: Biaya
C201: Radius 1 | D201: Radius II | E201: Radius III | F201: Radius IV | G201: Radius V | H201: Radius VI
A202: 1 | B202: Transportasi PS | C202: 500000 | D202: 750000 | E202: 1000000 | F202: 1500000 | G202: 1750000 | H202: 2000000
A203: 2 | B203: Pemberitahuan Kepada Lurah/kepala Desa | C203: 100000 | D203: 100000 | E203: 150000 | F203: 300000 | G203: 150000 | H203: 300000
A204: 3 | B204: PNBP PS | C204: 10000 | D204: 10000 | E204: 10000 | F204: 10000 | G204: 10000 | H204: 10000
A205: JUMLAH | C205: =SUM(C202:C204) -> 610000 | D205: =SUM(D202:D204) -> 860000 | E205: =SUM(E202:E204) -> 1160000 | F205: =SUM(F202:F204) -> 1810000 | G205: =SUM(G202:G204) -> 1910000 | H205: =SUM(H202:H204) -> 2310000
A207: CATATAN :
A208: 1. Biaya-biaya tersebut bisa berubah ditentukan menurut keadaan banyaknya pihak yang berperkara, letak dan jauhnya tempat tinggal pihak yang berperkara
A209: 2. Apabila biaya perkara selama proses berlangsung tersebut habis / kurang untuk tambahan biaya dibebankan kepada pihak Penggugat / Pelawan
A210: 3. Apabila perkara putus ada kelebihan biaya perkara akan dikembalikan kepada pihak Penggugat / Pemohon
A211: 4. Apabila dalam waktu 180 (seratus delapan puluh) hari setelah diberitahukan sisa panjar tidak diambil, akan disetor ke Kas Negara sebagai Pendapatan Negara Bukan Pajak (PNBP)
A212: * Biaya Pelaksanaan Eksekusi terdiri dari: 1. Konsumsi dilapangan (15 orang) Rp. 700.000 2. Honor Petugas Pelaksana Eksekusi Rp. 2.500.000 (Panitera Rp. 500.000,
A213: Tim Eksekusi 5 x @Rp. 300.000, Saksi 2 x @Rp. 250.000) 3. Honor Lurah dll 4 x @Rp.200.000 Rental Mobil (transportasi) Rp. 500.000
A214: * Biaya pengosongan dan lelang dilihat dari obyek sengketa yang dilelang / tempat lelang dari para pihak serta situasi dan kondisi lapangan.
D216: DITETAPKAN DI : TONDANO
D217: PADA TANGGAL : MEI 2023
D218: WAKIL KETUA PENGADILAN NEGERI TONDANO
D219: KELAS 1B
D223: ERENST JANNES ULAEN, SH, M.H
D224: NIP. 197001281997031001